<?xml version="1.0" encoding="UTF-8" ?>
<deska:úřední_deska
    xmlns="http://opendata.gov.cz/schema/xsd/typy/"
    xmlns:xsi="http://www.w3.org/2001/XMLSchema-instance"
    xmlns:deska="https://data.gov.cz/otevřené-formální-normy/úřední-desky/"
    xsi:schemaLocation="https://data.gov.cz/otevřené-formální-normy/úřední-desky/
                        https://data.gov.cz/otevřené-formální-normy/úřední-desky/draft/schémata/úřední-deska.xsd"
    xmlns:x="https://příklad.cz"
    >
    <deska:url>https://example.com/uredni_deska/</deska:url>
    <deska:organizace>
        <deska:ičo>00258245</deska:ičo>
    </deska:organizace>
    <deska:oznámení>
        <deska:identifikátor>2018-13</deska:identifikátor>
        <deska:url>https://example.com/uredni_deska/2018-2</deska:url>
        <deska:název>Podpora spolkového života ve městě</deska:název>
        <deska:zveřejněno>2018-01-20</deska:zveřejněno>
        <deska:sejmuto>2018-02-20</deska:sejmuto>
    </deska:oznámení>
    <deska:oznámení>
        <deska:identifikátor>2018-14</deska:identifikátor>
        <deska:url>https://example.com/uredni_deska/2018-3</deska:url>
        <deska:název>Podpora spolkového života ve městě II</deska:název>
        <deska:zveřejněno>2018-03-20</deska:zveřejněno>
        <deska:sejmuto>2018-04-20</deska:sejmuto>
        <x:zveřejnil>Mirek Dušín</x:zveřejnil>
        <x:odbor>VD</x:odbor>
    </deska:oznámení>
</deska:úřední_deska>
