<?xml version="1.0" encoding="UTF-8" ?>
<deska:úřední_deska
    xmlns="http://opendata.gov.cz/schema/xsd/typy/"
    xmlns:xsi="http://www.w3.org/2001/XMLSchema-instance"
    xmlns:deska="https://ofn.gov.cz/úřední-desky/"
    xsi:schemaLocation="https://ofn.gov.cz/úřední-desky/
                        https://ofn.gov.cz/úřední-desky/draft/schémata/úřední-deska.xsd"
    >
    <deska:url>https://example.com/uredni_deska/</deska:url>
    <deska:provozovatel>
        <deska:ičo>00258245</deska:ičo>
    </deska:provozovatel>
    <deska:oznámení>
        <deska:identifikátor>2018-13</deska:identifikátor>
        <deska:url>https://example.com/uredni_deska/2018-2</deska:url>
        <deska:název>Podpora spolkového života ve městě</deska:název>
        <deska:zveřejněno>2018-01-20</deska:zveřejněno>
        <deska:sejmuto>2018-02-20</deska:sejmuto>
    </deska:oznámení>
</deska:úřední_deska>
